{"_type":"https://in-toto.io/Statement/v1","predicate":{"claimed_state":"accepted","governance_case":{"acceptance_records":[{"accepted_at":"2026-01-01T00:05:00Z","decision_id":"DECISION-1","evidence_digest":"sha256:8f6d210321c77abc1fd7db040bd588697671de03a3fbc4974ae9f3fed4695dd5","evidence_id":"EVIDENCE-1","human_id":"HUMAN-1","id":"ACCEPTANCE-1","quorum_status":"met","receipt_digest":"sha256:a8f42277e3dda775fda8cdb10d5aea12455692e3408b09579ec00620b88cc827","review_digest":"sha256:7e4215c691a9d3be02afcee4849deb6439d451ce6e83b5657634b7d1b312c636","review_id":"REVIEW-1","reviewed_head":"1111111111111111111111111111111111111111","status":"accepted","work_item_id":"WORK-VECTOR-ACCEPTED"}],"attempt":{"actor":"PALARI-BUILDER","allowed_paths":["outputs/result.txt"],"base_sha":"0000000000000000000000000000000000000000","changed_files":["outputs/result.txt"],"cleanliness":"clean","commits":["1111111111111111111111111111111111111111"],"forbidden_paths":[],"head_sha":"1111111111111111111111111111111111111111","id":"ATTEMPT-1","output_targets":["outputs/result.txt"],"result":"Artifact created.","started_at":"2026-01-01T00:00:00Z","status":"completed","updated_at":"2026-01-01T00:01:00Z","work_item_id":"WORK-VECTOR-ACCEPTED"},"claimed_state":"accepted","contract":{"acceptance_target":"The artifact is current and independently accepted.","allowed_actions":["local_write"],"allowed_resources":["outputs/result.txt"],"allowed_sources":["SOURCE-1"],"conflict_targets":[],"current_attempt_id":"ATTEMPT-1","forbidden_actions":["external_write"],"goal":"GOAL-1","id":"WORK-VECTOR-ACCEPTED","intensity":"high","output_targets":["outputs/result.txt"],"palari":"PALARI-BUILDER","parallel_policy":"independent","parent_work_item_id":"","required_approval_capability":"architecture","required_approval_count":1,"risk":"R4","scope":"Create one output artifact.","status":"active","title":"Accepted vector","verification_expectations":["sha256"],"workbench_id":""},"dependencies":[],"evidence":{"artifact_hashes":[{"path":"outputs/result.txt","sha256":"7029b91dfcb4fbdb0605c453e53065060443557fedc3a27c16e606bde1eaa5af","status":"present"}],"artifacts":["outputs/result.txt"],"attempt_id":"ATTEMPT-1","base_ref":"","commands":["sha256 outputs/result.txt"],"freshness":"current","head_sha":"1111111111111111111111111111111111111111","id":"EVIDENCE-1","manifest_hash":"","previous_receipt_hash":"","receipt_digest":"sha256:a8f42277e3dda775fda8cdb10d5aea12455692e3408b09579ec00620b88cc827","receipt_hash":"","receipt_id":"RECEIPT-1","status":"passed","summary":"Artifact digest verified.","timestamp":"2026-01-01T00:03:00Z","work_item_id":"WORK-VECTOR-ACCEPTED"},"human_decisions":[{"acceptance_mode":"human","decision":"accepted","evidence_digest":"sha256:8f6d210321c77abc1fd7db040bd588697671de03a3fbc4974ae9f3fed4695dd5","evidence_id":"EVIDENCE-1","human_id":"HUMAN-1","id":"DECISION-1","quorum_status":"met","review_digest":"sha256:7e4215c691a9d3be02afcee4849deb6439d451ce6e83b5657634b7d1b312c636","review_id":"REVIEW-1","reviewed_head":"1111111111111111111111111111111111111111","status":"accepted","timestamp":"2026-01-01T00:05:00Z","work_item_id":"WORK-VECTOR-ACCEPTED"}],"humans":[{"approval_capabilities":["architecture"],"id":"HUMAN-1"}],"observations":{"evidence_integrity":{"details":[],"status":"verified"},"journal_continuity":{"details":[],"status":"not-required"},"subject_integrity":{"details":[],"status":"verified"}},"open_decisions":[],"outcome":{"id":"OUTCOME-1","status":"captured","timestamp":"2026-01-01T00:06:00Z","work_item_id":"WORK-VECTOR-ACCEPTED"},"receipt":{"actions_taken":["created_output"],"actor":"PALARI-BUILDER","attempt_id":"ATTEMPT-1","context_hash":"sha256:2222222222222222222222222222222222222222222222222222222222222222","evidence_manifest_hash":"","external_writes":[],"id":"RECEIPT-1","not_done":["external_write"],"outputs_created":["outputs/result.txt"],"planned_external_writes":[],"previous_receipt_hash":"","queued_external_writes":[],"receipt_hash":"","sources_used":["SOURCE-1"],"timestamp":"2026-01-01T00:02:00Z","undo_refs":[],"work_item_id":"WORK-VECTOR-ACCEPTED"},"review":{"attempt_digest":"sha256:39e577f5f96242543b865912399b3bdf92aa3d5ebadc0f7b635373da40678b44","attempt_id":"ATTEMPT-1","checks_inspected":["artifact_digest"],"contract_digest":"sha256:1f085f7ad9da6598e7bc62011ae77fce708d529d1c7b82abfef615410de9a01f","evidence_digest":"sha256:8f6d210321c77abc1fd7db040bd588697671de03a3fbc4974ae9f3fed4695dd5","evidence_id":"EVIDENCE-1","findings":[],"id":"REVIEW-1","receipt_digest":"sha256:a8f42277e3dda775fda8cdb10d5aea12455692e3408b09579ec00620b88cc827","receipt_id":"RECEIPT-1","residual_risks":["declared_identity_only"],"reviewed_head":"1111111111111111111111111111111111111111","reviewer":"PALARI-REVIEWER","timestamp":"2026-01-01T00:04:00Z","verdict":"accept-ready","work_item_id":"WORK-VECTOR-ACCEPTED"},"reviewer_authorities":[{"id":"PALARI-REVIEWER","kind":"palari"}],"schema_version":"pcaw.governance_case.v1","sources":[{"allowed_palaris":["PALARI-BUILDER"],"authority":"company_owned","data_class":"internal","freshness":"current","id":"SOURCE-1","redaction_required":false,"selected":true,"steward_human":"HUMAN-1"}]},"schema_version":"pcaw.v1","security_limitations":["actor-attribution-declared-not-authenticated","no-signatures-or-key-custody","same-user-tampering-not-prevented"],"subject_roles":[{"name":"urn:palari:work-state:WORK-VECTOR-ACCEPTED","role":"work-state"},{"name":"outputs/result.txt","role":"output-artifact"}]},"predicateType":"https://palari.dev/pcaw/v1","subject":[{"digest":{"sha256":"5e82ac0e31e37a5ebd4e7c531d5996d416fd0474058d06092964f25bd5bd375a"},"name":"urn:palari:work-state:WORK-VECTOR-ACCEPTED"},{"digest":{"sha256":"7029b91dfcb4fbdb0605c453e53065060443557fedc3a27c16e606bde1eaa5af"},"name":"outputs/result.txt"}]}